{
  "schema_version": "1.0.0",
  "package_id": "BD-AF-P0P3-V1",
  "package_fingerprint": "REQUIRED_64_HEX",
  "task_id": "REQUIRED_TASK_ID",
  "baseline_commit": "REQUIRED_TASK_START_40_HEX",
  "actual_head": "REQUIRED_ACCEPTED_CHANGESET_40_HEX",
  "dependency_result_sha256": {},
  "approval_relative_path": "REQUIRED_TASK_ID/approvals/REQUIRED_TASK_ID.approval.json",
  "approval_sha256": "REQUIRED_64_HEX",
  "approval_signature_relative_path": "REQUIRED_TASK_ID/approvals/REQUIRED_TASK_ID.approval.json.sig",
  "approval_signature_sha256": "REQUIRED_64_HEX",
  "evidence_manifests": [
    {
      "criterion_id": "REQUIRED_CRITERION_OR_ROLLBACK_ID",
      "relative_path": "REQUIRED_TASK_ID/evidence/REQUIRED.evidence.json",
      "sha256": "REQUIRED_64_HEX",
      "status": "PASS"
    }
  ],
  "changed_paths": [],
  "implementer_identity": "REQUIRED_IMPLEMENTER_IDENTITY",
  "implementer_status": "NOT_VERIFIABLE",
  "reviewer_status": null,
  "reviewer_identity": null,
  "reviewed_at": null,
  "reviewer_record_relative_path": null,
  "reviewer_record_sha256": null,
  "reviewer_signature_relative_path": null,
  "reviewer_signature_sha256": null,
  "residual_risks": []
}
